{
  "$schema": "../schema.json",
  "id": "tokyo-night-pro",
  "name": "Tokyo Night Pro",
  "minAppVersion": 87,
  "inheritBase": true,
  "dark": {
    "baseColors": {
      "primary": "#7aa2f7",
      "onPrimary": "#1a1b26",
      "primaryContainer": "#3b4261",
      "onPrimaryContainer": "#c0caf5",
      "secondary": "#565f89",
      "onSecondary": "#c0caf5",
      "secondaryContainer": "#2d324a",
      "onSecondaryContainer": "#c0caf5",
      "tertiary": "#3b4261",
      "onTertiary": "#c0caf5",
      "tertiaryContainer": "#1a1b26",
      "onTertiaryContainer": "#c0caf5",
      "error": "#f7768e",
      "errorContainer": "#f7768e",
      "onError": "#1a1b26",
      "onErrorContainer": "#1a1b26",
      "background": "#1a1b26",
      "onBackground": "#c0caf5",
      "surface": "#1a1b26",
      "onSurface": "#c0caf5",
      "surfaceVariant": "#24283b",
      "onSurfaceVariant": "#a9b1d6",
      "outline": "#565f89",
      "inverseOnSurface": "#1a1b26",
      "inverseSurface": "#c0caf5",
      "inversePrimary": "#7aa2f7",
      "surfaceTint": "#7aa2f7",
      "outlineVariant": "#565f89",
      "scrim": "#000000",
      "surfaceDim": "#1a1b26",
      "surfaceBright": "#24283b",
      "surfaceContainerLowest": "#1a1b26",
      "surfaceContainerLow": "#1a1b26",
      "surfaceContainer": "#24283b",
      "surfaceContainerHigh": "#2d324a",
      "surfaceContainerHighest": "#3b4261"
    },
    "terminalColors": {
      "cursor": "#c0caf5",
      "color0": "#1d202f",
      "color1": "#f7768e",
      "color2": "#9ece6a",
      "color3": "#e0af68",
      "color4": "#7aa2f7",
      "color5": "#bb9af7",
      "color6": "#7dcfff",
      "color7": "#a9b1d6",
      "color8": "#3b4261",
      "color9": "#f7768e",
      "color10": "#9ece6a",
      "color11": "#e0af68",
      "color12": "#7aa2f7",
      "color13": "#bb9af7",
      "color14": "#7dcfff",
      "color15": "#c0caf5",
      "color16": "#e0af68",
      "color17": "#7dcfff",
      "color18": "#1a1b26",
      "color19": "#24283b",
      "color20": "#565f89",
      "color21": "#c0caf5"
    },
    "editorColors": {
      "whole_background": "#1a1b26",
      "text_normal": "#c0caf5",
      "current_line": "#24283b",
      "line_number": "#3b4261",
      "line_number_current": "#7aa2f7",
      "line_number_background": "#1a1b26",
      "selected_text_background": "#7aa2f740",
      "selection_handle": "#7aa2f7",
      "selection_insert": "#7aa2f7",
      "non_printable_char": "#565f89",
      "line_divider": "#2d324a",
      "side_block_line": "#565f89",
      "scroll_bar_thumb": "#2d324a",
      "scroll_bar_thumb_pressed": "#565f89",
      "scroll_bar_track": "#1a1b26",
      "completion_wnd_background": "#24283b",
      "completion_wnd_corner": "#1a1b26",
      "completion_wnd_item_current": "#2d324a",
      "completion_wnd_text_matched": "#7aa2f7",
      "completion_wnd_text_primary": "#c0caf5",
      "completion_wnd_text_secondary": "#565f89",
      "diagnostic_tooltip_action": "#7aa2f7",
      "diagnostic_tooltip_background": "#24283b",
      "diagnostic_tooltip_brief_msg": "#c0caf5",
      "diagnostic_tooltip_detailed_msg": "#c0caf5",
      "function_char_background_stroke": "#7aa2f7",
      "hard_wrap_marker": "#565f89",
      "highlighted_delimiters_background": "#3b4261",
      "highlighted_delimiters_foreground": "#e0af68",
      "highlighted_delimiters_underline": "#7aa2f7",
      "hover_background": "#24283b",
      "hover_border": "#2d324a",
      "hover_text_highlighted": "#7aa2f7",
      "hover_text_normal": "#c0caf5",
      "line_number_panel": "#7aa2f7",
      "line_number_panel_text": "#1a1b26",
      "matched_text_background": "#e0af6844",
      "problem_error": "#f7768e",
      "problem_typo": "#9ece6a",
      "problem_warning": "#e0af68",
      "signature_background": "#24283b",
      "signature_border": "#2d324a",
      "signature_text_highlighted_parameter": "#7aa2f7",
      "signature_text_normal": "#c0caf5",
      "snippet_background_editing": "#7aa2f744",
      "snippet_background_inactive": "#24283b",
      "snippet_background_related": "#24283b",
      "static_span_background": "#24283b",
      "static_span_foreground": "#c0caf5",
      "sticky_scroll_divider": "#565f89",
      "strikethrough": "#565f89",
      "text_action_window_background": "#24283b",
      "text_action_window_icon_color": "#c0caf5",
      "text_inlay_hint_background": "#2d324a",
      "text_inlay_hint_foreground": "#565f89",
      "text_selected": "#c0caf5",
      "underline": "#7aa2f7",
      "block_line": "#c0caf5",
      "block_line_current": "#c0caf5",
      "text_highlight_background": "#7aa2f740",
      "text_highlight_border": "#7aa2f7",
      "text_highlight_strong_background": "#bb9af740",
      "text_highlight_strong_border": "#bb9af7",
      "matched_text_border": "#e0af68",
      "selected_text_border": "#7aa2f7",
      "current_row_border": "#7aa2f7"
    },
    "tokenColors": [
      {"scope": "comment", "settings": {"foreground": "#565f89", "fontStyle": "italic"}},
      {"scope": "comment.line", "settings": {"foreground": "#565f89", "fontStyle": "italic"}},
      {"scope": "comment.block", "settings": {"foreground": "#565f89", "fontStyle": "italic"}},
      {"scope": "comment.line.documentation", "settings": {"foreground": "#565f89", "fontStyle": "italic"}},
      {"scope": "keyword", "settings": {"foreground": "#bb9af7"}},
      {"scope": "keyword.control", "settings": {"foreground": "#bb9af7"}},
      {"scope": "keyword.operator", "settings": {"foreground": "#89ddff"}},
      {"scope": "keyword.operator.logical", "settings": {"foreground": "#89ddff"}},
      {"scope": "keyword.operator.assignment", "settings": {"foreground": "#89ddff"}},
      {"scope": "keyword.operator.comparison", "settings": {"foreground": "#89ddff"}},
      {"scope": "keyword.operator.arithmetic", "settings": {"foreground": "#89ddff"}},
      {"scope": "keyword.operator.bitwise", "settings": {"foreground": "#89ddff"}},
      {"scope": "keyword.operator.access", "settings": {"foreground": "#89ddff"}},
      {"scope": "keyword.operator.range", "settings": {"foreground": "#89ddff"}},
      {"scope": "keyword.operator.arrow", "settings": {"foreground": "#89ddff"}},
      {"scope": "keyword.operator.dereference", "settings": {"foreground": "#89ddff"}},
      {"scope": "keyword.operator.namespace", "settings": {"foreground": "#89ddff"}},
      {"scope": "keyword.operator.borrow", "settings": {"foreground": "#89ddff"}},
      {"scope": "keyword.operator.increment-decrement", "settings": {"foreground": "#89ddff"}},
      {"scope": "keyword.control.directive", "settings": {"foreground": "#565f89"}},
      {"scope": "keyword.control.import", "settings": {"foreground": "#7dcfff"}},
      {"scope": "keyword.control.package", "settings": {"foreground": "#7dcfff"}},
      {"scope": "storage", "settings": {"foreground": "#bb9af7"}},
      {"scope": "storage.type", "settings": {"foreground": "#bb9af7"}},
      {"scope": "storage.modifier", "settings": {"foreground": "#bb9af7"}},
      {"scope": "string", "settings": {"foreground": "#9ece6a"}},
      {"scope": "string.quoted", "settings": {"foreground": "#9ece6a"}},
      {"scope": "string.quoted.double", "settings": {"foreground": "#9ece6a"}},
      {"scope": "string.quoted.single", "settings": {"foreground": "#9ece6a"}},
      {"scope": "string.quoted.triple", "settings": {"foreground": "#9ece6a"}},
      {"scope": "string.quoted.raw", "settings": {"foreground": "#9ece6a"}},
      {"scope": "string.regexp", "settings": {"foreground": "#9ece6a"}},
      {"scope": "constant", "settings": {"foreground": "#e0af68"}},
      {"scope": "constant.numeric", "settings": {"foreground": "#e0af68"}},
      {"scope": "constant.numeric.decimal", "settings": {"foreground": "#e0af68"}},
      {"scope": "constant.numeric.hex", "settings": {"foreground": "#e0af68"}},
      {"scope": "constant.numeric.oct", "settings": {"foreground": "#e0af68"}},
      {"scope": "constant.numeric.bin", "settings": {"foreground": "#e0af68"}},
      {"scope": "constant.numeric.float", "settings": {"foreground": "#e0af68"}},
      {"scope": "constant.language", "settings": {"foreground": "#bb9af7"}},
      {"scope": "constant.language.boolean", "settings": {"foreground": "#e0af68"}},
      {"scope": "constant.language.null", "settings": {"foreground": "#e0af68"}},
      {"scope": "constant.character", "settings": {"foreground": "#e0af68"}},
      {"scope": "constant.character.escape", "settings": {"foreground": "#e0af68"}},
      {"scope": "entity", "settings": {"foreground": "#c0caf5"}},
      {"scope": "entity.name", "settings": {"foreground": "#c0caf5"}},
      {"scope": "entity.name.function", "settings": {"foreground": "#7aa2f7"}},
      {"scope": "entity.name.function.definition", "settings": {"foreground": "#7aa2f7"}},
      {"scope": "entity.name.function.declaration", "settings": {"foreground": "#7aa2f7"}},
      {"scope": "entity.name.function.call", "settings": {"foreground": "#7aa2f7"}},
      {"scope": "entity.name.function.macro", "settings": {"foreground": "#7aa2f7"}},
      {"scope": "entity.name.type", "settings": {"foreground": "#0db9d7"}},
      {"scope": "entity.name.type.class", "settings": {"foreground": "#0db9d7"}},
      {"scope": "entity.name.type.struct", "settings": {"foreground": "#0db9d7"}},
      {"scope": "entity.name.type.enum", "settings": {"foreground": "#0db9d7"}},
      {"scope": "entity.name.type.typedef", "settings": {"foreground": "#0db9d7"}},
      {"scope": "entity.name.type.primitive", "settings": {"foreground": "#0db9d7"}},
      {"scope": "entity.name.type.trait", "settings": {"foreground": "#0db9d7"}},
      {"scope": "entity.name.type.interface", "settings": {"foreground": "#0db9d7"}},
      {"scope": "entity.name.type.union", "settings": {"foreground": "#0db9d7"}},
      {"scope": "entity.name.namespace", "settings": {"foreground": "#c0caf5"}},
      {"scope": "entity.name.tag", "settings": {"foreground": "#f7768e"}},